number,value,datetime_start,datetime_complete,duration,params_knn_algorithm,params_knn_leaf,params_knn_neighbours,params_knn_weights,state
164,0.11094650205761314,2022-09-17 15:56:52.475350,2022-09-17 15:59:28.000745,0 days 00:02:35.525395,kd_tree,171,3,distance,COMPLETE
165,0.11088065843621397,2022-09-17 15:57:44.169987,2022-09-17 16:02:03.482915,0 days 00:04:19.312928,kd_tree,966,3,distance,COMPLETE
166,0.25038683127572003,2022-09-17 15:58:39.458445,2022-09-17 16:24:22.573676,0 days 00:25:43.115231,kd_tree,972,993,distance,COMPLETE
167,0.11088065843621397,2022-09-17 15:59:28.122893,2022-09-17 16:11:21.606157,0 days 00:11:53.483264,ball_tree,785,3,distance,COMPLETE
168,0.10592592592592598,2022-09-17 16:01:38.535788,2022-09-17 16:12:27.616318,0 days 00:10:49.080530,ball_tree,221,2,distance,COMPLETE
169,0.10592592592592598,2022-09-17 16:01:46.014295,2022-09-17 16:11:46.674275,0 days 00:10:00.659980,ball_tree,238,2,distance,COMPLETE
170,0.10592592592592598,2022-09-17 16:02:03.604451,2022-09-17 16:12:36.803786,0 days 00:10:33.199335,ball_tree,238,2,distance,COMPLETE
171,0.10592592592592598,2022-09-17 16:02:28.334817,2022-09-17 16:11:24.698202,0 days 00:08:56.363385,ball_tree,238,2,distance,COMPLETE
172,0.10592592592592598,2022-09-17 16:04:22.992970,2022-09-17 16:14:25.157916,0 days 00:10:02.164946,ball_tree,188,2,distance,COMPLETE
173,0.10592592592592598,2022-09-17 16:06:56.495273,2022-09-17 16:18:54.956580,0 days 00:11:58.461307,ball_tree,74,2,distance,COMPLETE
174,0.10592592592592598,2022-09-17 16:11:21.803828,2022-09-17 16:24:54.297395,0 days 00:13:32.493567,ball_tree,98,2,distance,COMPLETE
175,0.10592592592592598,2022-09-17 16:11:24.761793,2022-09-17 16:13:45.667696,0 days 00:02:20.905903,kd_tree,487,2,distance,COMPLETE
176,0.10600823045267493,2022-09-17 16:11:46.805030,2022-09-17 16:14:18.860702,0 days 00:02:32.055672,brute,217,2,distance,COMPLETE
177,0.10592592592592598,2022-09-17 16:12:27.702253,2022-09-17 16:21:06.906762,0 days 00:08:39.204509,ball_tree,247,2,distance,COMPLETE
178,0.10592592592592598,2022-09-17 16:12:36.936924,2022-09-17 16:22:12.349737,0 days 00:09:35.412813,ball_tree,895,2,distance,COMPLETE
179,0.10592592592592598,2022-09-17 16:13:45.869008,2022-09-17 16:15:59.534038,0 days 00:02:13.665030,kd_tree,532,2,distance,COMPLETE
180,0.10592592592592598,2022-09-17 16:14:18.998215,2022-09-17 16:17:45.927871,0 days 00:03:26.929656,kd_tree,528,2,distance,COMPLETE
181,0.10592592592592598,2022-09-17 16:14:25.216012,2022-09-17 16:16:38.328178,0 days 00:02:13.112166,kd_tree,509,2,distance,COMPLETE
182,0.11089711934156377,2022-09-17 16:15:59.618194,2022-09-17 16:24:41.153892,0 days 00:08:41.535698,ball_tree,554,3,distance,COMPLETE
183,0.11088065843621397,2022-09-17 16:16:38.411757,2022-09-17 16:19:10.189267,0 days 00:02:31.777510,kd_tree,414,3,distance,COMPLETE
184,0.11089711934156377,2022-09-17 16:17:46.071573,2022-09-17 16:32:56.636915,0 days 00:15:10.565342,ball_tree,410,3,distance,COMPLETE
185,0.11088065843621397,2022-09-17 16:18:55.104259,2022-09-17 16:23:34.953969,0 days 00:04:39.849710,kd_tree,423,3,distance,COMPLETE
186,0.11093004115226346,2022-09-17 16:19:10.246189,2022-09-17 16:26:16.188797,0 days 00:07:05.942608,ball_tree,41,3,distance,COMPLETE
187,0.14452674897119344,2022-09-17 16:21:06.986640,2022-09-17 16:22:59.211629,0 days 00:01:52.224989,kd_tree,65,3,uniform,COMPLETE
188,0.13917695473251024,2022-09-17 16:22:12.431015,2022-09-17 16:31:35.852727,0 days 00:09:23.421712,ball_tree,143,16,distance,COMPLETE
189,0.10592592592592598,2022-09-17 16:22:59.291706,2022-09-17 16:25:18.082911,0 days 00:02:18.791205,kd_tree,795,2,distance,COMPLETE
190,0.10592592592592598,2022-09-17 16:23:35.099415,2022-09-17 16:36:36.767879,0 days 00:13:01.668464,ball_tree,787,2,distance,COMPLETE
191,0.10592592592592598,2022-09-17 16:24:22.742175,2022-09-17 16:36:53.131188,0 days 00:12:30.389013,ball_tree,704,2,distance,COMPLETE
192,0.10592592592592598,2022-09-17 16:24:41.227340,2022-09-17 16:34:50.108361,0 days 00:10:08.881021,ball_tree,699,2,distance,COMPLETE
193,0.10592592592592598,2022-09-17 16:24:54.432661,2022-09-17 16:36:19.917971,0 days 00:11:25.485310,ball_tree,639,2,distance,COMPLETE
194,0.10592592592592598,2022-09-17 16:25:18.156378,2022-09-17 16:26:46.738721,0 days 00:01:28.582343,kd_tree,70,2,distance,COMPLETE
195,0.10592592592592598,2022-09-17 16:26:16.252675,2022-09-17 16:28:03.076693,0 days 00:01:46.824018,kd_tree,314,2,distance,COMPLETE
196,0.10592592592592598,2022-09-17 16:26:46.811382,2022-09-17 16:28:16.942488,0 days 00:01:30.131106,kd_tree,66,2,distance,COMPLETE
197,0.10600823045267493,2022-09-17 16:28:03.140291,2022-09-17 16:30:48.548778,0 days 00:02:45.408487,brute,158,2,distance,COMPLETE
198,0.13787654320987652,2022-09-17 16:28:17.021839,2022-09-17 16:34:26.865565,0 days 00:06:09.843726,kd_tree,306,15,distance,COMPLETE
199,0.10592592592592598,2022-09-17 16:30:48.683510,2022-09-17 16:33:14.879278,0 days 00:02:26.195768,kd_tree,285,2,distance,COMPLETE
